{
  "id": "ps-enablement",
  "name": "PS Enablement",
  "purpose": "Generates branded discovery slide decks from Attention call transcripts, triggered from Slack. Runtime in Zapier; this repo is the source-of-truth backup.",
  "stage": "alpha",
  "district": "Enablement",
  "tier": 2,
  "slot": 0,
  "studioAsset": "ps-enablement.png",
  "depends_on": [],
  "links": {
    "repo": "https://github.com/charleslim-ps/ps-enablement",
    "project": "https://linear.app/charles-ai/project/ps-enablement-466e652c72a3"
  },
  "sources": {
    "repo": "charleslim-ps/ps-enablement",
    "linearProjectId": "72a6b280-3a1b-4e28-bedd-06f1f2eaf24c"
  }
}
