{
  "id": "marketplace-overlap",
  "name": "Marketplace Overlap",
  "purpose": "Matchmaking switchboard. Joins partner domains against cited domains to ship a recruitment list of high-overlap partners.",
  "stage": "alpha",
  "district": "AEO",
  "tier": 1,
  "slot": 2,
  "studioAsset": "marketplace.png",
  "depends_on": ["aeo-maxxing"],
  "links": {
    "repo": "https://github.com/charleslim-ps/marketplace-overlap",
    "project": "https://linear.app/charles-ai/project/marketplace-overlap-666c955e34c5"
  },
  "sources": {
    "repo": "charleslim-ps/marketplace-overlap",
    "linearProjectId": "b44d68d8-0801-466d-810e-28fa0d2b6a11"
  }
}
