{
  "id": "hq",
  "name": "Charles AI Studios HQ",
  "purpose": "The launchpad itself — the cake topper. Rolls up the health of every studio and is the front door to the lot.",
  "stage": "alpha",
  "district": "HQ",
  "tier": 0,
  "slot": 0,
  "studioAsset": "hq.png",
  "depends_on": [],
  "links": {
    "repo": "https://github.com/charleslim-ps/ai-studios",
    "launch": "https://charleslim-ai.pages.dev",
    "project": "https://linear.app/charles-ai/project/charles-ai-studios-hq-490d222449cc"
  },
  "sources": {
    "repo": "charleslim-ps/ai-studios",
    "linearProjectId": "775ab66a-b4c7-494f-9a3b-d5b91a03a56f"
  }
}
