{
  "id": "glossary-swot",
  "name": "Glossary SWOT",
  "purpose": "Hall of card catalogs. Scores /glossary pages on demand/rank + content health, reading the citation dataset to find SWOT opportunities.",
  "stage": "alpha",
  "district": "AEO",
  "tier": 1,
  "slot": 1,
  "studioAsset": "glossary.png",
  "depends_on": ["aeo-maxxing"],
  "links": {
    "repo": "https://github.com/charleslim-ps/glossary-swot",
    "project": "https://linear.app/charles-ai/project/glossary-swot-be67a6d38cb9"
  },
  "sources": {
    "repo": "charleslim-ps/glossary-swot",
    "linearProjectId": "e5a04d63-bfcc-4641-ab92-c4ac5982c03c"
  }
}
